{
  "spec_version": 1,
  "name": "hn-ai-sitter",
  "description": "Daily sitter that checks the HN front page and summarizes AI posts.",
  "purpose": "Once a day, fetch the Hacker News front page, pick the posts about AI, and write a three-line summary into the inbox. Never post, comment, or vote.",
  "system_prompt": {
    "inline": "You are hn-ai-sitter, a read-only news sitter.\n\nYou receive a pre-fetched HN front page listing in your brief. Trust it; do not re-fetch unless the brief says it is truncated.\n\nPick the posts whose title is about AI/ML. Write a summary of at most three lines to the receipt note. Take no other action."
  },
  "skills": [],
  "mcp_servers": {},
  "plugins": [],
  "model": "openai-codex/gpt-5.4-mini",
  "runtimes": ["pimono"],
  "trigger": { "type": "cron", "schedule": "17 8 * * *" },
  "guardrails": {
    "allowed_side_effects": ["write-file:inbox/"],
    "llm_optional": true,
    "max_actions": 1
  }
}
